{
  "eventId": "b0000000-0000-4000-8000-000000000003",
  "eventType": "payment.approved",
  "version": 1,
  "occurredAt": "2026-09-18T12:00:00Z",
  "traceId": "4bf92f3577b34da6a3ce929d0e0e4736",
  "orderId": "c0000000-0000-4000-8000-000000000001",
  "payload": {
    "paymentId": "90000000-0000-4000-8000-000000000001",
    "method": "PIX",
    "amount": 56.8,
    "currency": "BRL",
    "approvedAt": "2026-09-18T12:00:10Z",
    "providerReference": "stub-approved-001"
  }
}
